{
  "title": "KNO-001 — SFIA Engineering Principles",
  "status": "Published",
  "category": "Reference",
  "publishedDate": "2026-06-27",
  "tags": ["Architecture", "AI"],
  "summary": "Document fondateur décrivant les principes d'ingénierie de la SFIA.",
  "content": "# SFIA Engineering Principles\n\n## Préambule\n\nLa SFIA est une plateforme d'ingénierie dont l'objectif est de transformer une idée en un produit, un composant ou une solution de manière structurée, traçable et réutilisable.\n\nCes principes constituent le cadre de référence de tous les projets réalisés avec la SFIA.\n\n# 1. Les besoins réels avant les idées\n\nLa SFIA évolue uniquement pour répondre à un besoin identifié sur un projet réel.\n\nAucune fonctionnalité n'est développée \"au cas où\".\n\n# 2. Une seule tâche à la fois\n\nChaque chantier possède un objectif clair.\n\nUn chantier est terminé avant d'en ouvrir un autre.\n\n# 3. Concevoir avant de développer\n\nToute implémentation est précédée d'une phase de conception.\n\nL'architecture guide le développement, jamais l'inverse.\n\n# 4. La simplicité est une exigence\n\nLa solution la plus simple répondant au besoin est privilégiée.\n\nChaque nouvelle complexité doit être justifiée.\n\n# 5. Les composants sont autonomes\n\nChaque composant possède son propre cycle de vie :\n- Conception\n- Développement\n- Tests\n- Documentation\n- Version\n- Clôture\n\n# 6. Les décisions sont tracées\n\nToute décision structurante est documentée dans un ADR.\n\nAucune décision importante ne repose uniquement sur les échanges.\n\n# 7. Le référentiel est la source de vérité\n\nNotion constitue le référentiel officiel de la plateforme.\n\nToute documentation durable y est centralisée.\n\n# 8. Le code appartient au dépôt Git\n\nLe code, les scripts et les versions sont gérés exclusivement dans Git.\n\nLe référentiel documentaire ne remplace jamais le dépôt de code.\n\n# 9. Chaque amélioration est mesurable\n\nUne amélioration doit apporter au moins un des bénéfices suivants :\n- simplification ;\n- robustesse ;\n- réutilisabilité ;\n- gain de temps ;\n- réduction du risque.\n\n# 10. Tester avant de publier\n\nAucune version n'est publiée sans validation.\n\nLes tests sont considérés comme faisant partie intégrante du composant.\n\n# 11. Industrialiser ce qui est récurrent\n\nUne tâche répétitive est automatisée uniquement lorsqu'elle devient suffisamment fréquente pour justifier son coût de développement.\n\n# 12. Le référentiel évolue en continu\n\nLa SFIA n'est jamais considérée comme figée.\n\nLes retours d'expérience, les projets et les expérimentations alimentent son évolution de manière continue.\n\n# 13. Les outils ont des responsabilités claires\n\n- ChatGPT : conception, architecture, analyse et aide à la décision.\n- Cursor : développement et implémentation.\n- Notion : référentiel de connaissance et gouvernance.\n- Git : gestion du code source et des versions.\n\nChaque outil possède un rôle précis et complémentaire.\n\n# 14. Construire pour être réutilisé\n\nTout artefact produit dans la SFIA doit pouvoir être réutilisé dans un autre projet avec un minimum d'adaptation.\n\n# 15. La plateforme sert les projets\n\nLa SFIA n'est pas une finalité.\n\nSa raison d'être est de permettre de concevoir, développer et maintenir des projets de meilleure qualité, plus rapidement et avec une gouvernance cohérente."
}
